bucket_id,bucket_actors,bucket_size,bucket_start_date,bucket_end_date,title_id,title_display,title_norm,pub_date,gate_actor,bucket_added_at
B-2025-08-31-GB,['GB'],30,2025-08-31 14:09:00,2025-09-06 13:01:31,6e7f276e-d914-4aa5-9a7b-e17785acdb7b,At least 15 hospitalised after double-decker bus crashes in London,at least 15 hospitalised after double-decker bus crashes in london,2025-09-04 12:40:40,GB,2025-09-09 06:49:10
B-2025-08-31-GB,['GB'],30,2025-08-31 14:09:00,2025-09-06 13:01:31,baf4f0d4-c2c8-45b1-be42-009ae32cbe5a,"‘Coalition of the Willing’ Security Guarantees ‘Substantial’ and ‘Real,’ UK Says","coalition of the willing security guarantees substantial and real, uk says",2025-09-03 20:38:17,GB,2025-09-09 06:49:10
B-2025-08-31-GB,['GB'],30,2025-08-31 14:09:00,2025-09-06 13:01:31,e11905c2-95de-426d-a394-71fafbc0b0d8,"Retail giant shuts all UK stores, website for a day in solidarity with Gaza","retail giant shuts all uk stores, website for a day in solidarity with gaza",2025-09-03 11:03:40,GB,2025-09-09 06:49:10
B-2025-08-31-GB,['GB'],30,2025-08-31 14:09:00,2025-09-06 13:01:31,78a08c6f-e280-47a8-bbc2-80e7fffa8081,Toxic materials found in fake Labubu dolls seized across UK | Daily Sabah,toxic materials found in fake labubu dolls seized across uk daily sabah,2025-09-03 09:08:09,GB,2025-09-09 06:49:10
B-2025-08-31-GB,['GB'],30,2025-08-31 14:09:00,2025-09-06 13:01:31,35290335-a351-4625-a376-dfb8faada57d,"New BP pill a gamechanger, works when all others fail: Why UK clinical trial is hope for those with resistant hypertension","new bp pill a gamechanger, works when all others fail: why uk clinical trial is hope for those with resistant hypertension",2025-09-03 08:39:54,GB,2025-09-09 06:49:10
B-2025-08-31-GB,['GB'],30,2025-08-31 14:09:00,2025-09-06 13:01:31,54eb532d-19a8-4ec2-90d2-fc66b3d93a32,UK police arrest five campaigners against Palestine Action ban - War on Gaza - War on Gaza,uk police arrest five campaigners against palestine action ban - war on gaza - war on gaza,2025-09-02 16:34:05,GB,2025-09-09 06:49:10
B-2025-08-31-GB,['GB'],30,2025-08-31 14:09:00,2025-09-06 13:01:31,e567e622-0049-4558-841a-0237c46dfd4d,Have mass deportations become a vote-winning ticket in the UK?,have mass deportations become a vote-winning ticket in the uk?,2025-09-01 11:46:54,GB,2025-09-09 06:49:10
B-2025-08-31-GB,['GB'],30,2025-08-31 14:09:00,2025-09-06 13:01:31,4654b55c-90a5-47b6-b39f-69a11c3be5ef,Former Columbia University President Appointed As UK Economic Adviser,former columbia university president appointed as uk economic adviser,2025-08-31 14:09:00,GB,2025-09-09 06:49:10
B-2025-08-31-HAMAS-IL,"['IL', 'HAMAS']",18,2025-08-31 11:04:00,2025-09-06 01:36:00,54711c59-6412-4561-89b9-89f176481543,"Hamas releases hostage video, Israel bombs Gaza high-rise","hamas releases hostage video, israel bombs gaza high-rise",2025-09-06 01:36:00,IL,2025-09-09 06:49:10
B-2025-08-31-HAMAS-IL,"['IL', 'HAMAS']",18,2025-08-31 11:04:00,2025-09-06 01:36:00,7c79567f-5e65-4b49-98f0-75fd62dbc846,"Hamas releases hostage video, Israel bombs Gaza high-rise","hamas releases hostage video, israel bombs gaza high-rise",2025-09-06 01:36:00,IL,2025-09-09 06:49:10
B-2025-08-31-HAMAS-IL,"['IL', 'HAMAS']",18,2025-08-31 11:04:00,2025-09-06 01:36:00,359f1a03-16e8-4277-97c4-db05d4e6dc50,Israel has officially moved on from destroying Hamas to erasing Palestine,israel has officially moved on from destroying hamas to erasing palestine,2025-09-05 19:40:00,IL,2025-09-09 06:49:10
B-2025-08-31-HAMAS-IL,"['IL', 'HAMAS']",18,2025-08-31 11:04:00,2025-09-06 01:36:00,8e657182-4608-4cb3-b95f-52084be27866,Israel has officially moved on from destroying Hamas to erasing Palestine,israel has officially moved on from destroying hamas to erasing palestine,2025-09-05 19:40:00,IL,2025-09-09 06:49:10
B-2025-08-31-HAMAS-IL,"['IL', 'HAMAS']",18,2025-08-31 11:04:00,2025-09-06 01:36:00,cf16bc6c-e5ef-47c9-95a7-797ed2df7bb5,Israel strikes Gaza City high-rise building as Hamas releases another hostage video,israel strikes gaza city high-rise building as hamas releases another hostage video,2025-09-05 09:42:10,IL,2025-09-09 06:49:10
B-2025-08-31-HAMAS-IL,"['IL', 'HAMAS']",18,2025-08-31 11:04:00,2025-09-06 01:36:00,9247adbe-7184-41dd-91fe-d6f78bc40b7c,"'Every day is Oct. 7': Israel marks 700 days of war, 48 hostages remain in Hamas captivity","every day is oct. 7: israel marks 700 days of war, 48 hostages remain in hamas captivity",2025-09-05 06:28:09,IL,2025-09-09 06:49:10
B-2025-08-31-HAMAS-IL,"['IL', 'HAMAS']",18,2025-08-31 11:04:00,2025-09-06 01:36:00,b52cd674-9fb6-47c6-aff1-ee4bb29a5fde,Israel calls EU’s Ribera ‘Hamas mouthpiece’ after genocide accusation,israel calls eus ribera hamas mouthpiece after genocide accusation,2025-09-04 20:40:30,IL,2025-09-09 06:49:10
B-2025-08-31-HAMAS-IL,"['IL', 'HAMAS']",18,2025-08-31 11:04:00,2025-09-06 01:36:00,2b75eb20-fe35-414c-a0d0-0b18f9da422f,"Palestinian death toll passes 64,000, health officials say, as Israel and Hamas dig in on demands","palestinian death toll passes 64,000, health officials say, as israel and hamas dig in on demands",2025-09-04 20:24:36,IL,2025-09-09 06:49:10
B-2025-08-31-HAMAS-IL,"['IL', 'HAMAS']",18,2025-08-31 11:04:00,2025-09-06 01:36:00,78d023b6-6726-4947-8a25-37557c542a0f,Gaza: Israel rejects 'spin' after Hamas says ready for comprehensive deal,gaza: israel rejects spin after hamas says ready for comprehensive deal,2025-09-04 15:20:00,IL,2025-09-09 06:49:10
B-2025-08-31-HAMAS-IL,"['IL', 'HAMAS']",18,2025-08-31 11:04:00,2025-09-06 01:36:00,7e8ee344-d706-45f1-a26e-86c8c3d51cbf,"Israel tells Hamas to surrender or see Gaza City leveled, as group says it’s open to deal","israel tells hamas to surrender or see gaza city leveled, as group says its open to deal",2025-09-04 00:42:00,IL,2025-09-09 06:49:10
B-2025-08-31-HAMAS-IL,"['IL', 'HAMAS']",18,2025-08-31 11:04:00,2025-09-06 01:36:00,10d5b01e-8267-45f5-90e3-46bc6ae21747,Israel Rejects Hamas Statement on Deal to End Gaza War as 'More Empty Spin',israel rejects hamas statement on deal to end gaza war as more empty spin,2025-09-04 00:24:00,IL,2025-09-09 06:49:10
B-2025-08-31-HAMAS-IL,"['IL', 'HAMAS']",18,2025-08-31 11:04:00,2025-09-06 01:36:00,9b593231-8dab-4e67-b578-7a98fac57706,Opinion | Three Big Lies About the Israel-Hamas War,opinion three big lies about the israel-hamas war,2025-09-03 20:55:00,IL,2025-09-09 06:49:10
B-2025-08-31-HAMAS-IL,"['IL', 'HAMAS']",18,2025-08-31 11:04:00,2025-09-06 01:36:00,16a7546a-6108-4d78-ba3b-640418a8cc02,Israel kills Hamas spokesman as dozens reported killed in Gaza City,israel kills hamas spokesman as dozens reported killed in gaza city,2025-09-02 07:47:21,IL,2025-09-09 06:49:10
B-2025-08-31-HAMAS-IL,"['IL', 'HAMAS']",18,2025-08-31 11:04:00,2025-09-06 01:36:00,11600954-5cfb-4881-a14c-cb19fed2e074,Genocide scholars say IDF committing genocide in Gaza; Israel: ‘Based on Hamas lies’,genocide scholars say idf committing genocide in gaza; israel: based on hamas lies,2025-09-01 14:50:00,IL,2025-09-09 06:49:10
B-2025-08-31-HAMAS-IL,"['IL', 'HAMAS']",18,2025-08-31 11:04:00,2025-09-06 01:36:00,8b94d2af-649e-4038-b3fe-05999b285525,"Hamas spokesman Abu Obeida killed in air strike, Israel claims","hamas spokesman abu obeida killed in air strike, israel claims",2025-08-31 17:48:45,IL,2025-09-09 06:49:10
B-2025-08-31-HAMAS-IL,"['IL', 'HAMAS']",18,2025-08-31 11:04:00,2025-09-06 01:36:00,e01534d4-06a0-4de7-8efe-98cff7e963d4,Israel kills Hamas spokesperson; hospitals report dozens killed in Gaza,israel kills hamas spokesperson; hospitals report dozens killed in gaza,2025-08-31 13:56:00,IL,2025-09-09 06:49:10
B-2025-08-31-HAMAS-IL,"['IL', 'HAMAS']",18,2025-08-31 11:04:00,2025-09-06 01:36:00,097c880b-3137-4f5a-9b5b-8723c9044917,Gaza : Israël annonce avoir tué le porte-parole de la branche armée du Hamas,gaza : israël annonce avoir tué le porte-parole de la branche armée du hamas,2025-08-31 12:35:16,IL,2025-09-09 06:49:10
B-2025-08-31-HAMAS-IL,"['IL', 'HAMAS']",18,2025-08-31 11:04:00,2025-09-06 01:36:00,4b580b9d-9930-49c1-aabf-33e6e1624786,Israel says it killed Hamas military spokesman Abu Obeida,israel says it killed hamas military spokesman abu obeida,2025-08-31 11:04:00,IL,2025-09-09 06:49:10
B-2025-08-31-HEZBOLLAH-IL,"['IL', 'HEZBOLLAH']",5,2025-08-31 18:33:45,2025-09-06 07:57:20,ad2239c6-fbc9-4bb4-af07-656db5df99ba,"Hezbollah says Lebanon move on army plan is 'opportunity,' urges Israel to commit to ceasefire","hezbollah says lebanon move on army plan is opportunity, urges israel to commit to ceasefire",2025-09-06 07:57:20,IL,2025-09-09 06:49:10
B-2025-08-31-HEZBOLLAH-IL,"['IL', 'HEZBOLLAH']",5,2025-08-31 18:33:45,2025-09-06 07:57:20,6e0b4b5a-ea17-410f-a60f-cf58d2ce8ec8,"Hezbollah says Lebanon move on army plan is 'opportunity,' urges Israel to commit to ceasefire","hezbollah says lebanon move on army plan is opportunity, urges israel to commit to ceasefire",2025-09-06 07:57:20,IL,2025-09-09 06:49:10
B-2025-08-31-HEZBOLLAH-IL,"['IL', 'HEZBOLLAH']",5,2025-08-31 18:33:45,2025-09-06 07:57:20,4258b04f-8fb6-4844-b3f1-3397924ff29f,"Lebanon approves army plan to disarm Hezbollah, says implementation depends also on Israel","lebanon approves army plan to disarm hezbollah, says implementation depends also on israel",2025-09-05 14:42:00,IL,2025-09-09 06:49:10
B-2025-08-31-HEZBOLLAH-IL,"['IL', 'HEZBOLLAH']",5,2025-08-31 18:33:45,2025-09-06 07:57:20,9dd0543f-9558-468c-abb8-4508f139588c,Israel starts building mock Lebanese village to train forces against Hezbollah,israel starts building mock lebanese village to train forces against hezbollah,2025-09-04 19:37:00,IL,2025-09-09 06:49:10
B-2025-08-31-HEZBOLLAH-IL,"['IL', 'HEZBOLLAH']",5,2025-08-31 18:33:45,2025-09-06 07:57:20,244e5bd4-3ec5-42e6-9290-51e1e7af819b,Israel strikes Lebanon as deadline for Hezbollah disarmament plan looms,israel strikes lebanon as deadline for hezbollah disarmament plan looms,2025-08-31 18:33:45,IL,2025-09-09 06:49:10
B-2025-08-31-ID-prabowo_subianto,"['ID', 'prabowo_subianto']",1,2025-08-31 08:51:00,2025-08-31 08:51:00,7b9c6862-efd4-4f77-aa9f-0055d30b08fe,"Indonesia unrest: Prabowo says parliament to remove controversial perks for MPs, suspend errant lawmakers","indonesia unrest: prabowo says parliament to remove controversial perks for mps, suspend errant lawmakers",2025-08-31 08:51:00,ID,2025-09-08 21:22:16
B-2025-08-31-IL,['IL'],122,2025-08-31 11:34:51,2025-09-06 13:01:31,2c682bc1-6ed8-49c7-979c-6d7de7ec1c7c,Israel turning prisons into ‘torture grounds’ with new weapons: Palestinian group,israel turning prisons into torture grounds with new weapons: palestinian group,2025-09-06 13:01:31,IL,2025-09-09 06:49:10
B-2025-08-31-IL,['IL'],122,2025-08-31 11:34:51,2025-09-06 13:01:31,a442fe34-4a56-4a6c-9249-9d6077deba66,Israel demolishes high-rise tower in Gaza city shortly after eviction order,israel demolishes high-rise tower in gaza city shortly after eviction order,2025-09-06 12:57:12,IL,2025-09-09 06:49:10
B-2025-08-31-IL,['IL'],122,2025-08-31 11:34:51,2025-09-06 13:01:31,549d9f46-46b5-42d5-aafb-92cce1c7b7e6,LIVE: Israel bombs Gaza residential tower after forced evacuation threat,live: israel bombs gaza residential tower after forced evacuation threat,2025-09-06 12:43:33,IL,2025-09-09 06:49:10
B-2025-08-31-IL,['IL'],122,2025-08-31 11:34:51,2025-09-06 13:01:31,8723e277-ddbe-492e-b329-55ec2ace7256,Israel starts plan of displacing Palestinians from Gaza city,israel starts plan of displacing palestinians from gaza city,2025-09-06 09:15:00,IL,2025-09-09 06:49:10
B-2025-08-31-IL,['IL'],122,2025-08-31 11:34:51,2025-09-06 13:01:31,4e62a89b-2d46-4d41-9130-f2e5791296ea,"'If 1948 Was a War of Independence, the Current War Could Be the One That Ends Israel'","if 1948 was a war of independence, the current war could be the one that ends israel",2025-09-06 06:53:00,IL,2025-09-09 06:49:10
B-2025-08-31-IL,['IL'],122,2025-08-31 11:34:51,2025-09-06 13:01:31,dc2acf19-fb1d-4d01-9df7-65795762a43d,Israel army urges Gaza City residents to leave for ‘humanitarian zone’,israel army urges gaza city residents to leave for humanitarian zone,2025-09-06 06:25:06,IL,2025-09-09 06:49:10
B-2025-08-31-IL,['IL'],122,2025-08-31 11:34:51,2025-09-06 13:01:31,520a6fb7-d29e-4686-9394-c17c12343353,"The Times of Israel | News from Israel, the Middle East and the Jewish World","the times of israel news from israel, the middle east and the jewish world",2025-09-06 05:08:35,IL,2025-09-09 06:49:10
B-2025-08-31-IL,['IL'],122,2025-08-31 11:34:51,2025-09-06 13:01:31,21f9f394-8290-407a-aaf1-386f44b5f58d,BDS calls to boycott reunion over Radiohead’s stance on Israel and Gaza amid upcoming tour,bds calls to boycott reunion over radioheads stance on israel and gaza amid upcoming tour,2025-09-06 01:12:31,IL,2025-09-09 06:49:10
B-2025-08-31-IL,['IL'],122,2025-08-31 11:34:51,2025-09-06 13:01:31,cc22e872-a24e-4af3-8468-9dc3b53d51d4,Updates: Israel kills dozens in Gaza; warns ‘gates of hell opening’,updates: israel kills dozens in gaza; warns gates of hell opening,2025-09-05 22:52:30,IL,2025-09-09 06:49:10
B-2025-08-31-IL,['IL'],122,2025-08-31 11:34:51,2025-09-06 13:01:31,1c5fa664-4e1f-43f3-8ed1-5cdf9244e8fc,Conflicto árabe israelí - 5 de septiembre de 2025 | Israel bombardea una torre en Ciudad de Gaza tras amenazar con abrir las “puertas del infierno” en la Franja,conflicto árabe israelí - 5 de septiembre de 2025 israel bombardea una torre en ciudad de gaza tras amenazar con abrir las puertas del infierno en la franja,2025-09-05 21:40:21,IL,2025-09-09 06:49:10
B-2025-08-31-IL,['IL'],122,2025-08-31 11:34:51,2025-09-06 13:01:31,27e9015a-d771-4274-a58c-064899b4987f,Israel beats Moldova 4-0 in WC Qualifiers,israel beats moldova 4-0 in wc qualifiers,2025-09-05 21:32:29,IL,2025-09-09 06:49:10
B-2025-08-31-IL,['IL'],122,2025-08-31 11:34:51,2025-09-06 13:01:31,4454b22b-eced-4a56-9ffb-bc976d5f7020,Israel Gears Up to Occupy Gaza but May Find That Gaza Has Occupied It,israel gears up to occupy gaza but may find that gaza has occupied it,2025-09-05 20:29:00,IL,2025-09-09 06:49:10
B-2025-08-31-IL,['IL'],122,2025-08-31 11:34:51,2025-09-06 13:01:31,376f6a1c-a52a-4905-b2e0-71b3b7eb96a1,Why Israel must annex Judea and Samaria now,why israel must annex judea and samaria now,2025-09-05 19:21:00,IL,2025-09-09 06:49:10
B-2025-08-31-IL,['IL'],122,2025-08-31 11:34:51,2025-09-06 13:01:31,60caf69a-7a6f-4f7f-be71-41107035336f,Jlm Light Rail 'almost' works: How Miri Regev tricks Israel,jlm light rail almost works: how miri regev tricks israel,2025-09-05 18:28:08,IL,2025-09-09 06:49:10
B-2025-08-31-IL,['IL'],122,2025-08-31 11:34:51,2025-09-06 13:01:31,c84d6742-bca8-4c65-bec1-e8e38fe3e1f3,Israel strikes high-rise building and threatens to hit more in Gaza City offensive,israel strikes high-rise building and threatens to hit more in gaza city offensive,2025-09-05 17:54:00,IL,2025-09-09 06:49:10
B-2025-08-31-IL,['IL'],122,2025-08-31 11:34:51,2025-09-06 13:01:31,4ca0bf6c-c943-4ff7-9c71-899919199f57,"Israel destroys high-rise after 30-minute evacuation warning, intensifies Gaza City offensive","israel destroys high-rise after 30-minute evacuation warning, intensifies gaza city offensive",2025-09-05 16:18:45,IL,2025-09-09 06:49:10
B-2025-08-31-IL,['IL'],122,2025-08-31 11:34:51,2025-09-06 13:01:31,532dd01d-5248-444f-9511-bbd6c3cf3544,Maíllo se desmarca de los ministros de Sumar y va más allá en sus reclamaciones sobre Israel,maíllo se desmarca de los ministros de sumar y va más allá en sus reclamaciones sobre israel,2025-09-05 16:13:28,IL,2025-09-09 06:49:10
B-2025-08-31-IL,['IL'],122,2025-08-31 11:34:51,2025-09-06 13:01:31,405d421b-6f10-47c1-8def-465da9aa4fa9,Australians protest against Palestinian state recognition in Israel,australians protest against palestinian state recognition in israel,2025-09-05 16:10:18,IL,2025-09-09 06:49:10
B-2025-08-31-IL,['IL'],122,2025-08-31 11:34:51,2025-09-06 13:01:31,99710ba5-be44-4ec5-af94-d0c79be6a0ee,US sanctions Palestinian rights groups over ICC Israel war crimes probe - War on Gaza - War on Gaza,us sanctions palestinian rights groups over icc israel war crimes probe - war on gaza - war on gaza,2025-09-05 15:31:05,IL,2025-09-09 06:49:10
B-2025-08-31-IL,['IL'],122,2025-08-31 11:34:51,2025-09-06 13:01:31,b2cac927-4731-4544-81e3-c90bb7f1e152,What is the newest Israel-Korea defense agreement?,what is the newest israel-korea defense agreement?,2025-09-05 15:12:36,IL,2025-09-09 06:49:10
B-2025-08-31-IL,['IL'],122,2025-08-31 11:34:51,2025-09-06 13:01:31,468e7c34-1e70-43d5-b9fb-a6a954eecdff,The Perilous Pursuit of 'Greater Israel',the perilous pursuit of greater israel,2025-09-05 15:12:07,IL,2025-09-09 06:49:10
B-2025-08-31-IL,['IL'],122,2025-08-31 11:34:51,2025-09-06 13:01:31,79bbcc9a-b2bc-490d-93e9-5e25f73584f4,Otra protesta contra Israel interrumpe la fuga de la Vuelta camino al Angliru,otra protesta contra israel interrumpe la fuga de la vuelta camino al angliru,2025-09-05 14:31:45,IL,2025-09-09 06:49:10
B-2025-08-31-IL,['IL'],122,2025-08-31 11:34:51,2025-09-06 13:01:31,7d6a1de6-20a3-4ac6-8f7e-b03e8c48ed7a,Israel destroys dozens of buildings in Gaza City as new offensive intensifies,israel destroys dozens of buildings in gaza city as new offensive intensifies,2025-09-05 14:25:09,IL,2025-09-09 06:49:10
B-2025-08-31-IL,['IL'],122,2025-08-31 11:34:51,2025-09-06 13:01:31,a556b10b-a97f-4489-a56a-a2d0b947660d,Israel destroys dozens of buildings in Gaza City as new offensive intensifies,israel destroys dozens of buildings in gaza city as new offensive intensifies,2025-09-05 14:25:09,IL,2025-09-09 06:49:10
B-2025-08-31-IL,['IL'],122,2025-08-31 11:34:51,2025-09-06 13:01:31,fb9e67e7-2a8b-4646-a563-904cbdbdc2c0,Israel bombs high-rise towers as brutal Gaza City assault intensifies,israel bombs high-rise towers as brutal gaza city assault intensifies,2025-09-05 13:45:51,IL,2025-09-09 06:49:10
B-2025-08-31-IL,['IL'],122,2025-08-31 11:34:51,2025-09-06 13:01:31,d719c1ef-cd6a-425e-980e-f602da97e9a7,"Israel is blasting through Gaza City neighborhoods, but people have nowhere to go","israel is blasting through gaza city neighborhoods, but people have nowhere to go",2025-09-05 13:39:34,IL,2025-09-09 06:49:10
B-2025-08-31-IL,['IL'],122,2025-08-31 11:34:51,2025-09-06 13:01:31,e3105c48-33d1-43f4-acf8-824fca3cc3df,"Israel backs troubled Mediterranean power cable to Europe, amid Cyprus-Greece spat","israel backs troubled mediterranean power cable to europe, amid cyprus-greece spat",2025-09-05 13:39:13,IL,2025-09-09 06:49:10
B-2025-08-31-IL,['IL'],122,2025-08-31 11:34:51,2025-09-06 13:01:31,966a46fc-342b-4b99-950e-67d872edaa9a,Measles-infected passenger traveled from New York to Israel,measles-infected passenger traveled from new york to israel,2025-09-05 13:27:00,IL,2025-09-09 06:49:10
B-2025-08-31-IL,['IL'],122,2025-08-31 11:34:51,2025-09-06 13:01:31,9ad04d4f-d1cc-42c8-9a00-f7bfd9e2b805,"Finland to sign declaration on two-state solution for Israel, Palestinians","finland to sign declaration on two-state solution for israel, palestinians",2025-09-05 12:40:29,IL,2025-09-09 06:49:10
B-2025-08-31-IL,['IL'],122,2025-08-31 11:34:51,2025-09-06 13:01:31,7f7e839c-4ffe-49eb-97f9-afb20700e71c,Israel destroys one of Gaza City’s biggest buildings,israel destroys one of gaza citys biggest buildings,2025-09-05 12:27:07,IL,2025-09-09 06:49:10
B-2025-08-31-IL,['IL'],122,2025-08-31 11:34:51,2025-09-06 13:01:31,f6f95e4d-efdd-4994-b517-dd326fe3b078,The West’s double standards on Israel - Opinion - Opinion,the wests double standards on israel - opinion - opinion,2025-09-05 09:50:53,IL,2025-09-09 06:49:10
B-2025-08-31-IL,['IL'],122,2025-08-31 11:34:51,2025-09-06 13:01:31,acca6c34-1e4f-4129-90b5-9d397e5e6e0d,"Israel targets Palestinians at aid distribution centers, kills 25 civilians, Friday","israel targets palestinians at aid distribution centers, kills 25 civilians, friday",2025-09-05 09:44:00,IL,2025-09-09 06:49:10
B-2025-08-31-IL,['IL'],122,2025-08-31 11:34:51,2025-09-06 13:01:31,625f7470-1957-4445-a68d-f43feaae8df9,"Finland joins declaration on two-state solution between Israel, Palestinians","finland joins declaration on two-state solution between israel, palestinians",2025-09-05 08:00:08,IL,2025-09-09 06:49:10
B-2025-08-31-IL,['IL'],122,2025-08-31 11:34:51,2025-09-06 13:01:31,8d3f3bc0-48c3-496c-b059-ef9e7f6032e5,'I Feel Deeply Connected to Israel. I Have No Idea Why. My Dream Is to Live Here',i feel deeply connected to israel. i have no idea why. my dream is to live here,2025-09-05 05:48:00,IL,2025-09-09 06:49:10
B-2025-08-31-IL,['IL'],122,2025-08-31 11:34:51,2025-09-06 13:01:31,58d7381b-025a-4f76-889c-4a15f6f15944,"Hostages’ families, activists mark 700 days since October 7 with protests across Israel","hostages families, activists mark 700 days since october 7 with protests across israel",2025-09-05 04:55:00,IL,2025-09-09 06:49:10
B-2025-08-31-IL,['IL'],122,2025-08-31 11:34:51,2025-09-06 13:01:31,df7fc3d6-6bfd-48bb-a243-88c703c207ec,Scotland’s parliament votes for boycott of Israel amid Gaza genocide,scotlands parliament votes for boycott of israel amid gaza genocide,2025-09-05 03:34:00,IL,2025-09-09 06:49:10
B-2025-08-31-IL,['IL'],122,2025-08-31 11:34:51,2025-09-06 13:01:31,acad140b-d05b-4a08-9856-2ab4962b2799,"After 700 Days of War, Israel Is in the Hands of an Evil and Indifferent Government","after 700 days of war, israel is in the hands of an evil and indifferent government",2025-09-05 03:01:00,IL,2025-09-09 06:49:10
B-2025-08-31-IL,['IL'],122,2025-08-31 11:34:51,2025-09-06 13:01:31,9d09a960-5980-4fcd-b2a5-dee3a64b5702,Israel must return to hostage deal talks while it still can,israel must return to hostage deal talks while it still can,2025-09-05 02:59:04,IL,2025-09-09 06:49:10
B-2025-08-31-IL,['IL'],122,2025-08-31 11:34:51,2025-09-06 13:01:31,c679c7ee-01d8-442a-9eae-96e33456ea58,US imposes sanctions on Palestinian groups seeking war crimes investigation against Israel,us imposes sanctions on palestinian groups seeking war crimes investigation against israel,2025-09-05 02:54:35,IL,2025-09-09 06:49:10
B-2025-08-31-IL,['IL'],122,2025-08-31 11:34:51,2025-09-06 13:01:31,5ce9227b-825e-4401-b5c6-029d5a52ef10,Israel takes 40% of Gaza City with eyes on military rule in forceful new offensive,israel takes 40 of gaza city with eyes on military rule in forceful new offensive,2025-09-05 01:44:05,IL,2025-09-09 06:49:10
B-2025-08-31-IL,['IL'],122,2025-08-31 11:34:51,2025-09-06 13:01:31,eef3b8f2-f747-4815-ab02-68ce4fbe48a1,US sanctions Palestinian rights groups over support for Israel war crimes probe,us sanctions palestinian rights groups over support for israel war crimes probe,2025-09-04 22:02:28,IL,2025-09-09 06:49:10
B-2025-08-31-IL,['IL'],122,2025-08-31 11:34:51,2025-09-06 13:01:31,d27a8149-6882-4083-98cd-040733c77d0b,Three Killed in Two Separate Shooting Incidents in Northern Israel,three killed in two separate shooting incidents in northern israel,2025-09-04 21:58:00,IL,2025-09-09 06:49:10
B-2025-08-31-IL,['IL'],122,2025-08-31 11:34:51,2025-09-06 13:01:31,38c697b5-805e-4034-be15-72f642f39f46,Israel plans Moldova terminal in NIS 20m Uman project,israel plans moldova terminal in nis 20m uman project,2025-09-04 21:57:57,IL,2025-09-09 06:49:10
B-2025-08-31-IL,['IL'],122,2025-08-31 11:34:51,2025-09-06 13:01:31,7b03e3e3-837a-481b-be89-178af3270bcd,US sanctions Palestinian rights groups for supporting ICC Israel probe,us sanctions palestinian rights groups for supporting icc israel probe,2025-09-04 21:23:32,IL,2025-09-09 06:49:10
B-2025-08-31-IL,['IL'],122,2025-08-31 11:34:51,2025-09-06 13:01:31,0792bbcd-95d5-448d-9dd6-9a2a12d3433e,Doncic leads Slovenia past Israel at EuroBasket 2025,doncic leads slovenia past israel at eurobasket 2025,2025-09-04 21:19:35,IL,2025-09-09 06:49:10
B-2025-08-31-IL,['IL'],122,2025-08-31 11:34:51,2025-09-06 13:01:31,55c80412-2401-49e1-a983-451ca4b70814,U.S. Sanctions Three Palestinian NGOs Over Cooperation With ICC Probe Against Israel,u.s. sanctions three palestinian ngos over cooperation with icc probe against israel,2025-09-04 20:27:00,IL,2025-09-09 06:49:10
B-2025-08-31-IL,['IL'],122,2025-08-31 11:34:51,2025-09-06 13:01:31,bf31ed1b-ff5c-41cc-8488-fe030ea88f88,Israel risks isolation due to its Middle East policies,israel risks isolation due to its middle east policies,2025-09-04 19:15:56,IL,2025-09-09 06:49:10
B-2025-08-31-IL,['IL'],122,2025-08-31 11:34:51,2025-09-06 13:01:31,96fa8ead-260e-4e21-8f10-114f42591e32,"Commander: Iran's Air Force downed drones, repelled attacks in 12-day war with Israel","commander: irans air force downed drones, repelled attacks in 12-day war with israel",2025-09-04 18:46:00,IL,2025-09-09 06:49:10
B-2025-08-31-IL,['IL'],122,2025-08-31 11:34:51,2025-09-06 13:01:31,2ec47595-b7a3-457b-b390-44eba8d7bb27,Org. criticizing Israel saw membership spike after Oct. 7,org. criticizing israel saw membership spike after oct. 7,2025-09-04 18:25:03,IL,2025-09-09 06:49:10
B-2025-08-31-IL,['IL'],122,2025-08-31 11:34:51,2025-09-06 13:01:31,848328ec-b467-4510-a7c1-deb2fb228d95,"Born to be wild in Jerusalem: Mike Huckabee, Amir Ohana and Paul Singer plan rock set - interview","born to be wild in jerusalem: mike huckabee, amir ohana and paul singer plan rock set - interview",2025-09-04 18:22:29,IL,2025-09-09 06:49:10
B-2025-08-31-IL,['IL'],122,2025-08-31 11:34:51,2025-09-06 13:01:31,50bf7ca3-fafe-49d4-b96e-4cc354859b02,Neto de Mandela diz que ocupação de Israel em territórios palestinos é pior do que o apartheid,neto de mandela diz que ocupação de israel em territórios palestinos é pior do que o apartheid,2025-09-04 18:08:00,IL,2025-09-09 06:49:10
B-2025-08-31-IL,['IL'],122,2025-08-31 11:34:51,2025-09-06 13:01:31,bb3ac468-2c8c-44e3-b119-6483825464ee,US blames countries recognizing Palestine amid push in Israel to annex West Bank,us blames countries recognizing palestine amid push in israel to annex west bank,2025-09-04 17:58:12,IL,2025-09-09 06:49:10
