bucket_id,bucket_actors,bucket_size,bucket_start_date,bucket_end_date,title_id,title_display,title_norm,pub_date,gate_actor,bucket_added_at
B-2025-09-02-emmanuel_macron,['emmanuel_macron'],10,2025-09-02 18:46:00,2025-09-05 23:01:07,34c5415c-bcdf-4ec5-81ec-108d70586890,"Macron Slams U.S. Over Palestinian Ban, Announces Two-state Solution Conference","macron slams u.s. over palestinian ban, announces two-state solution conference",2025-09-02 18:46:00,emmanuel_macron,2025-09-09 06:49:10
B-2025-09-02-EU-claudia_sheinbaum,"['EU', 'claudia_sheinbaum']",1,2025-09-02 11:56:00,2025-09-02 11:56:00,244d92ac-119a-4be3-aaed-423993e59623,"Sheinbaum: con EU, cooperación en seguridad, sin subordinación","sheinbaum: con eu, cooperación en seguridad, sin subordinación",2025-09-02 11:56:00,EU,2025-09-08 21:22:16
B-2025-09-02-EU-donald_trump,"['EU', 'donald_trump']",11,2025-09-02 05:00:26,2025-09-06 10:42:57,7dee97f3-423c-425b-a0c9-b3661b346a49,"Ue, ordine esecutivo Trump su dazi, verso 15% per auto","ue, ordine esecutivo trump su dazi, verso 15 per auto",2025-09-06 10:42:57,EU,2025-09-09 06:49:10
B-2025-09-02-EU-donald_trump,"['EU', 'donald_trump']",11,2025-09-02 05:00:26,2025-09-06 10:42:57,b5d26ec9-f9e3-40d0-9cec-8c3f73a0b6af,Trump threatens retaliation after EU hits Google with antitrust fine,trump threatens retaliation after eu hits google with antitrust fine,2025-09-06 06:08:18,EU,2025-09-09 06:49:10
B-2025-09-02-EU-donald_trump,"['EU', 'donald_trump']",11,2025-09-02 05:00:26,2025-09-06 10:42:57,4f8b53a4-5bc9-40d7-ab93-b77f01c9176b,EU-Kommission verhängt Milliardenstrafe gegen Google - Trump wettert,eu-kommission verhängt milliardenstrafe gegen google - trump wettert,2025-09-06 05:38:00,EU,2025-09-09 06:49:10
B-2025-09-02-EU-donald_trump,"['EU', 'donald_trump']",11,2025-09-02 05:00:26,2025-09-06 10:42:57,6c9562e5-7701-476e-ba47-282ec4b04dbb,EU massive fine against Google draws Trump threat,eu massive fine against google draws trump threat,2025-09-06 02:22:00,EU,2025-09-09 06:49:10
B-2025-09-02-EU-donald_trump,"['EU', 'donald_trump']",11,2025-09-02 05:00:26,2025-09-06 10:42:57,22572053-84ed-4fca-859f-b87aaf6dcdcc,Trump threatens retaliation against EU over Google fine,trump threatens retaliation against eu over google fine,2025-09-05 20:48:45,EU,2025-09-09 06:49:10
B-2025-09-02-EU-donald_trump,"['EU', 'donald_trump']",11,2025-09-02 05:00:26,2025-09-06 10:42:57,5b1a564b-b9b4-4996-8720-32a4f4e9f9bc,Trump threatens EU with retaliatory tariffs over ‘unfair’ $3.47bn Google fine,trump threatens eu with retaliatory tariffs over unfair 3.47bn google fine,2025-09-05 20:14:55,EU,2025-09-09 06:49:10
B-2025-09-02-EU-donald_trump,"['EU', 'donald_trump']",11,2025-09-02 05:00:26,2025-09-06 10:42:57,9c278672-3a5f-41d7-acdb-c0349de986fc,"""Very Unfair"": Trump Threatens EU Tariffs Over $3.4 Billion Google Antitrust Fine",very unfair: trump threatens eu tariffs over 3.4 billion google antitrust fine,2025-09-05 20:01:24,EU,2025-09-09 06:49:10
B-2025-09-02-EU-donald_trump,"['EU', 'donald_trump']",11,2025-09-02 05:00:26,2025-09-06 10:42:57,87e774a2-e9a8-449e-a468-bf580e4a42c0,Como a guerra tarifária de Trump acelerou validação do Acordo UE-Mercosul e como isso pode mudar o jogo do comércio internacional,como a guerra tarifária de trump acelerou validação do acordo ue-mercosul e como isso pode mudar o jogo do comércio internacional,2025-09-05 18:07:20,EU,2025-09-09 06:49:10
B-2025-09-02-EU-donald_trump,"['EU', 'donald_trump']",11,2025-09-02 05:00:26,2025-09-06 10:42:57,00395f86-9c4b-4bff-a5c8-f6fe615d4417,Trump threatens EU with tariff investigation after Google hit with $3.45 billion antitrust fine,trump threatens eu with tariff investigation after google hit with 3.45 billion antitrust fine,2025-09-05 15:57:00,EU,2025-09-09 06:49:10
B-2025-09-02-EU-donald_trump,"['EU', 'donald_trump']",11,2025-09-02 05:00:26,2025-09-06 10:42:57,d0ae4701-ad45-4faa-b33d-3ea3708cd9cf,Donald Trump threatens retaliatory tariffs after EU hits Google with €2.95bn fine,donald trump threatens retaliatory tariffs after eu hits google with 2.95bn fine,2025-09-05 15:15:06,EU,2025-09-09 06:49:10
B-2025-09-02-EU-donald_trump,"['EU', 'donald_trump']",11,2025-09-02 05:00:26,2025-09-06 10:42:57,15e7edfb-0e83-4830-8712-c1b92073ef2c,How Meta is using the Trump administration to lobby against EU tech rules,how meta is using the trump administration to lobby against eu tech rules,2025-09-02 05:00:26,EU,2025-09-09 06:49:10
B-2025-09-02-EU-robert_fico-vladimir_putin,"['EU', 'vladimir_putin', 'robert_fico']",1,2025-09-02 18:59:00,2025-09-02 18:59:00,989ca897-bb33-4f9a-be48-699ec35a879c,EU is out of touch with global reality – Fico to Putin,eu is out of touch with global reality fico to putin,2025-09-02 18:59:00,EU,2025-09-08 21:22:16
B-2025-09-02-EU-RU-robert_fico-vladimir_putin,"['RU', 'EU', 'vladimir_putin', 'robert_fico']",1,2025-09-02 13:12:49,2025-09-02 13:12:49,285f880d-aac9-4521-9a31-7ea59fd85c39,Putin to Slovakia’s Fico: Russia is open to Ukraine’s EU membership,putin to slovakias fico: russia is open to ukraines eu membership,2025-09-02 13:12:49,RU,2025-09-08 21:22:16
B-2025-09-02-EU-ursula_von_der_leyen,"['EU', 'ursula_von_der_leyen']",1,2025-09-02 05:11:39,2025-09-02 05:11:39,f4ad7485-2077-4699-a38a-4ccfd98e5393,"EU defence loans could come before January, von der Leyen says","eu defence loans could come before january, von der leyen says",2025-09-02 05:11:39,EU,2025-09-08 21:22:16
B-2025-09-02-friedrich_merz,['friedrich_merz'],5,2025-09-02 18:00:00,2025-09-05 15:46:55,db4677f3-feff-4041-a6fe-062390d32821,Germany's Merz inaugurates Nvidia supercomputer for research,germanys merz inaugurates nvidia supercomputer for research,2025-09-05 15:46:55,friedrich_merz,2025-09-08 21:22:16
B-2025-09-02-friedrich_merz,['friedrich_merz'],5,2025-09-02 18:00:00,2025-09-05 15:46:55,8b2f2d5e-d17d-4773-8c62-fb0caab8ab54,Germany's Merz inaugurates Nvidia supercomputer for research,germanys merz inaugurates nvidia supercomputer for research,2025-09-05 15:46:55,friedrich_merz,2025-09-08 21:22:16
B-2025-09-02-friedrich_merz,['friedrich_merz'],5,2025-09-02 18:00:00,2025-09-05 15:46:55,b53d0846-cfcc-43a5-9b44-79cf0d692595,Friedrich Merz gibt klein bei: Was vom Herbst der Reformen bleibt,friedrich merz gibt klein bei: was vom herbst der reformen bleibt,2025-09-04 17:41:34,friedrich_merz,2025-09-08 21:22:16
B-2025-09-02-friedrich_merz,['friedrich_merz'],5,2025-09-02 18:00:00,2025-09-05 15:46:55,7785bac8-3104-4a1b-a116-ad89ce1bd6eb,Germans are critical of Chancellor Merz and his government,germans are critical of chancellor merz and his government,2025-09-04 13:07:30,friedrich_merz,2025-09-08 21:22:16
B-2025-09-02-friedrich_merz,['friedrich_merz'],5,2025-09-02 18:00:00,2025-09-05 15:46:55,d6f8bb95-5336-4f2a-b702-07e89b76d244,Germany's Merz: Trump's Swiss tariffs 'exorbitantly high',germanys merz: trumps swiss tariffs exorbitantly high,2025-09-02 18:00:00,friedrich_merz,2025-09-08 21:22:16
B-2025-09-02-ID-UN,"['ID', 'UN']",1,2025-09-02 03:04:50,2025-09-02 03:04:50,7fb707cd-ed8b-4598-8922-a49c50b12f1c,UN urges investigations over deadly Indonesia protests,un urges investigations over deadly indonesia protests,2025-09-02 03:04:50,ID,2025-09-08 21:22:16
B-2025-09-02-IL-donald_trump,"['IL', 'donald_trump']",3,2025-09-02 04:43:30,2025-09-06 10:34:00,f1eb16a9-3175-4ec4-9c84-6e5e082ad483,"Trump says some hostages may have ‘recently died’ in Gaza, as Israel calls on Palestinians to evacuate the enclave’s largest city","trump says some hostages may have recently died in gaza, as israel calls on palestinians to evacuate the enclaves largest city",2025-09-06 10:34:00,IL,2025-09-09 06:49:10
B-2025-09-02-IL-donald_trump,"['IL', 'donald_trump']",3,2025-09-02 04:43:30,2025-09-06 10:34:00,aaf52fb1-252d-4207-93ad-4181b1e1f066,Israel had ‘total control’ over Congress – Trump,israel had total control over congress trump,2025-09-02 19:25:00,IL,2025-09-09 06:49:10
B-2025-09-02-IL-donald_trump,"['IL', 'donald_trump']",3,2025-09-02 04:43:30,2025-09-06 10:34:00,3d6582bd-3d95-4094-9366-c43125cd63a8,Donald Trump: Israel is losing support in Congress,donald trump: israel is losing support in congress,2025-09-02 04:43:30,IL,2025-09-09 06:49:10
B-2025-09-02-IL-emmanuel_macron,"['IL', 'emmanuel_macron']",4,2025-09-02 18:40:00,2025-09-05 03:51:00,76155ec1-711e-4e40-9354-3372c01034a1,Macron not welcome in Israel – foreign minister,macron not welcome in israel foreign minister,2025-09-05 03:51:00,IL,2025-09-08 21:22:16
B-2025-09-02-IL-emmanuel_macron,"['IL', 'emmanuel_macron']",4,2025-09-02 18:40:00,2025-09-05 03:51:00,2374a666-ad52-40d3-8fce-a1ed01e82e19,Macron not welcome in Israel – foreign minister,macron not welcome in israel foreign minister,2025-09-05 03:51:00,IL,2025-09-08 21:22:16
B-2025-09-02-IL-emmanuel_macron,"['IL', 'emmanuel_macron']",4,2025-09-02 18:40:00,2025-09-05 03:51:00,9bc7bd05-76f4-4ccc-a70c-68c66b12350b,Israel to rebuff Macron visit over French plan to recognize Palestinian state,israel to rebuff macron visit over french plan to recognize palestinian state,2025-09-04 17:56:55,IL,2025-09-08 21:22:16
B-2025-09-02-IL-emmanuel_macron,"['IL', 'emmanuel_macron']",4,2025-09-02 18:40:00,2025-09-05 03:51:00,43819ece-5b91-4901-b6da-2c801f498c37,There’s nothing Israel can do to halt push for Palestinian state recognition: Macron,theres nothing israel can do to halt push for palestinian state recognition: macron,2025-09-02 18:40:00,IL,2025-09-08 21:22:16
B-2025-09-02-IL-UN,"['IL', 'UN']",4,2025-09-02 08:59:00,2025-09-04 18:58:17,808c6f19-ecf4-495b-b12f-7d7393ccfcf5,"More than 40% of Gaza aid delivery missions blocked, impeded by Israel: UN","more than 40 of gaza aid delivery missions blocked, impeded by israel: un",2025-09-04 18:58:17,IL,2025-09-08 21:22:16
B-2025-09-02-IL-UN,"['IL', 'UN']",4,2025-09-02 08:59:00,2025-09-04 18:58:17,4e8a0754-554e-4022-ad64-fca40e1afbbc,Houthis claim 11 UN staffers arrested in Yemen this week were spying for Israel,houthis claim 11 un staffers arrested in yemen this week were spying for israel,2025-09-04 11:36:00,IL,2025-09-08 21:22:16
B-2025-09-02-IL-UN,"['IL', 'UN']",4,2025-09-02 08:59:00,2025-09-04 18:58:17,61598484-7e15-4eed-ad58-bd5ee0da8b22,"Belgium to recognize State of Palestine at UN General Assembly, impose sanctions on Israel","belgium to recognize state of palestine at un general assembly, impose sanctions on israel",2025-09-02 11:16:00,IL,2025-09-08 21:22:16
B-2025-09-02-IL-UN,"['IL', 'UN']",4,2025-09-02 08:59:00,2025-09-04 18:58:17,b044d57d-db3e-4f3c-8a19-865ff0673f22,"Belgium to recognize Palestinian state at UN General Assembly, impose sanctions on Israel","belgium to recognize palestinian state at un general assembly, impose sanctions on israel",2025-09-02 08:59:00,IL,2025-09-08 21:22:16
B-2025-09-02-IMF,['IMF'],8,2025-09-02 21:35:17,2025-09-06 06:19:41,d0259265-6c67-4abf-8bfd-b373e9832275,US to Receive Shares in Ukraine’s Minerals Fund for Military Aid,us to receive shares in ukraines minerals fund for military aid,2025-09-06 06:19:41,IMF,2025-09-09 06:49:10
B-2025-09-02-IMF,['IMF'],8,2025-09-02 21:35:17,2025-09-06 06:19:41,8354d3ec-697b-4e45-9496-9e89c94f6a79,"Benitez to DPWH: Ditch P120M solar studs, fund streetlights instead","benitez to dpwh: ditch p120m solar studs, fund streetlights instead",2025-09-06 04:03:00,IMF,2025-09-09 06:49:10
B-2025-09-02-IMF,['IMF'],8,2025-09-02 21:35:17,2025-09-06 06:19:41,a1470264-e0d2-4ead-890d-33ea71f90bda,MPs demand audit as Equalisation Fund nears expiry,mps demand audit as equalisation fund nears expiry,2025-09-05 17:30:00,IMF,2025-09-09 06:49:10
B-2025-09-02-IMF,['IMF'],8,2025-09-02 21:35:17,2025-09-06 06:19:41,76323053-22ee-4686-8adc-ed0e2e03af65,Former Bauer owner Graeme Roustan acquires True Hockey from U.S. private-equity fund,former bauer owner graeme roustan acquires true hockey from u.s. private-equity fund,2025-09-03 23:16:34,IMF,2025-09-09 06:49:10
B-2025-09-02-IMF,['IMF'],8,2025-09-02 21:35:17,2025-09-06 06:19:41,e795332e-f452-440b-afb2-2c3bc9f142b2,Top pension fund pulls €14bn from BlackRock in sustainability pivot,top pension fund pulls 14bn from blackrock in sustainability pivot,2025-09-03 10:51:37,IMF,2025-09-09 06:49:10
B-2025-09-02-IMF,['IMF'],8,2025-09-02 21:35:17,2025-09-06 06:19:41,1eadb65e-a909-4576-bc3d-9835bdca67b0,Commission to weigh abortion fund after pro-choice initiative,commission to weigh abortion fund after pro-choice initiative,2025-09-03 07:00:00,IMF,2025-09-09 06:49:10
B-2025-09-02-IMF,['IMF'],8,2025-09-02 21:35:17,2025-09-06 06:19:41,64385e11-87d7-4a73-9e98-1a4200b53c2b,EIB upskills Africa's next investment and fund managers,eib upskills africas next investment and fund managers,2025-09-03 06:00:00,IMF,2025-09-09 06:49:10
B-2025-09-02-IMF,['IMF'],8,2025-09-02 21:35:17,2025-09-06 06:19:41,2d6a309a-5c0e-455e-8c2b-07324b4cca50,SS&C Technologies To Acquire Curo Fund Services,ssc technologies to acquire curo fund services,2025-09-02 21:35:17,IMF,2025-09-09 06:49:10
B-2025-09-02-IMF-UA,"['UA', 'IMF']",1,2025-09-02 16:22:48,2025-09-02 16:22:48,1e1baf0b-f606-42f6-9b39-fb9d41fe2e70,Luxembourg seeks European teammates to fund US weaponry for Ukraine,luxembourg seeks european teammates to fund us weaponry for ukraine,2025-09-02 16:22:48,UA,2025-09-08 21:22:16
B-2025-09-02-IN-narendra_modi,"['IN', 'narendra_modi']",5,2025-09-02 08:19:16,2025-09-06 06:40:00,88e4358c-dabc-4a80-99a5-3145514647f6,"‘Deeply appreciate, fully reciprocate’: PM Modi hails Trump’s ‘positive assessment’ of India-US ties amid tariff tension","deeply appreciate, fully reciprocate: pm modi hails trumps positive assessment of india-us ties amid tariff tension",2025-09-06 06:40:00,IN,2025-09-09 06:49:10
B-2025-09-02-IN-narendra_modi,"['IN', 'narendra_modi']",5,2025-09-02 08:19:16,2025-09-06 06:40:00,4b6c651f-dc42-4ca4-8ece-d2e5360c3a54,Modi reciprocates Trump’s positive remarks amid strained India-US ties | Latest News India,modi reciprocates trumps positive remarks amid strained india-us ties latest news india,2025-09-06 05:25:12,IN,2025-09-09 06:49:10
B-2025-09-02-IN-narendra_modi,"['IN', 'narendra_modi']",5,2025-09-02 08:19:16,2025-09-06 06:40:00,334c8900-d63a-493d-85c7-49f9dc120789,India will drive global economy with ‘digital diamonds’ – Modi,india will drive global economy with digital diamonds modi,2025-09-03 14:56:00,IN,2025-09-09 06:49:10
B-2025-09-02-IN-narendra_modi,"['IN', 'narendra_modi']",5,2025-09-02 08:19:16,2025-09-06 06:40:00,19808f69-714c-4d1d-a67b-59bab5872740,IT Minister Ashwini Vaishnaw presents first ‘Made in India’ chip to PM Modi at Semicon 2025,it minister ashwini vaishnaw presents first made in india chip to pm modi at semicon 2025,2025-09-02 15:40:00,IN,2025-09-09 06:49:10
B-2025-09-02-IN-narendra_modi,"['IN', 'narendra_modi']",5,2025-09-02 08:19:16,2025-09-06 06:40:00,6c00bc5c-c182-4274-9cf0-1869bd0f37e8,"'She's gone, yet targeted': PM Modi gets emotional over mother's 'insult' at Rahul Gandhi's Bihar rally | Latest News India","shes gone, yet targeted: pm modi gets emotional over mothers insult at rahul gandhis bihar rally latest news india",2025-09-02 08:19:16,IN,2025-09-09 06:49:10
B-2025-09-02-IN-QA,"['IN', 'QA']",1,2025-09-02 08:54:00,2025-09-02 08:54:00,4af40ef9-d8fa-4398-aebb-ae28b5631623,Qatar Chamber suggests strengthening institutional relations between Doha and New Delhi in priority sectors| Gulf Times,qatar chamber suggests strengthening institutional relations between doha and new delhi in priority sectors gulf times,2025-09-02 08:54:00,IN,2025-09-08 21:22:16
B-2025-09-02-IN-WHO,"['IN', 'WHO']",1,2025-09-02 13:29:00,2025-09-02 13:29:00,86dd6c16-51fb-40bb-b4ca-4a455683810b,"WHO says over a billion people living with mental health conditions globally, 1 in 100 deaths is suicide: What are challenges in India?","who says over a billion people living with mental health conditions globally, 1 in 100 deaths is suicide: what are challenges in india?",2025-09-02 13:29:00,IN,2025-09-08 21:22:16
B-2025-09-02-javier_milei,['javier_milei'],11,2025-09-02 08:45:12,2025-09-06 01:56:00,05d4597f-e129-443b-bd08-209ba8992622,Karina Milei y Martín Menem sospechan de espionaje en Diputados y esperan que el fiscal Stornelli lo investigue,karina milei y martín menem sospechan de espionaje en diputados y esperan que el fiscal stornelli lo investigue,2025-09-06 01:56:00,javier_milei,2025-09-09 06:49:10
B-2025-09-02-javier_milei,['javier_milei'],11,2025-09-02 08:45:12,2025-09-06 01:56:00,3d17bffb-82bf-47f5-bf23-9f1cc4545c10,"Luis Juez contó que Karina Milei le pidió perdón y le respondió al Gordo Dan tras el ataque a su hija: ""No me ofendan, así no se defiende la libertad""","luis juez contó que karina milei le pidió perdón y le respondió al gordo dan tras el ataque a su hija: no me ofendan, así no se defiende la libertad",2025-09-06 00:11:20,javier_milei,2025-09-09 06:49:10
B-2025-09-02-javier_milei,['javier_milei'],11,2025-09-02 08:45:12,2025-09-06 01:56:00,113d36bf-a0f7-4dbb-96b3-c26339750ad4,Piden el juicio político del juez que favoreció a Karina Milei,piden el juicio político del juez que favoreció a karina milei,2025-09-05 13:17:00,javier_milei,2025-09-09 06:49:10
B-2025-09-02-javier_milei,['javier_milei'],11,2025-09-02 08:45:12,2025-09-06 01:56:00,cfdaf30c-4a37-48f7-9d77-a04ddbaf078f,"Visita exprés en Los Angeles: Javier Milei sedujo a los inversionistas, pero hay cautela por las elecciones","visita exprés en los angeles: javier milei sedujo a los inversionistas, pero hay cautela por las elecciones",2025-09-05 12:33:55,javier_milei,2025-09-09 06:49:10
B-2025-09-02-javier_milei,['javier_milei'],11,2025-09-02 08:45:12,2025-09-06 01:56:00,32d60d2b-04c6-444b-b485-367e3447a663,¿Perder o retroceder?: El Gobierno evalúa si judicializa la emergencia en discapacidad como había prometido Javier Milei,perder o retroceder?: el gobierno evalúa si judicializa la emergencia en discapacidad como había prometido javier milei,2025-09-04 23:32:34,javier_milei,2025-09-09 06:49:10
B-2025-09-02-javier_milei,['javier_milei'],11,2025-09-02 08:45:12,2025-09-06 01:56:00,deeb9839-c07d-418f-8104-daa856bb1c6d,O inferno astral de Javier Milei: escândalo de corrupção e eleições fazem liberal intervir no câmbio,o inferno astral de javier milei: escândalo de corrupção e eleições fazem liberal intervir no câmbio,2025-09-04 12:20:00,javier_milei,2025-09-09 06:49:10
B-2025-09-02-javier_milei,['javier_milei'],11,2025-09-02 08:45:12,2025-09-06 01:56:00,05495007-9de7-4435-9843-3932bb2f04ef,Entenda por que ultraliberal Milei decidiu intervir no câmbio argentino,entenda por que ultraliberal milei decidiu intervir no câmbio argentino,2025-09-03 07:01:45,javier_milei,2025-09-09 06:49:10
B-2025-09-02-javier_milei,['javier_milei'],11,2025-09-02 08:45:12,2025-09-06 01:56:00,d1e9a286-a3d4-4c8a-b39c-a1005810de98,Milei da una marcha atrás parcial con la liberación del mercado de cambios ante la desconfianza del mercado,milei da una marcha atrás parcial con la liberación del mercado de cambios ante la desconfianza del mercado,2025-09-02 16:51:08,javier_milei,2025-09-09 06:49:10
B-2025-09-02-javier_milei,['javier_milei'],11,2025-09-02 08:45:12,2025-09-06 01:56:00,8a9a9059-f47b-4678-9477-03aa24af09e5,"Lilia Lemoine pidió que se publiquen más audios de Karina Milei: ""Así Rial y Mauro Federico van presos""",lilia lemoine pidió que se publiquen más audios de karina milei: así rial y mauro federico van presos,2025-09-02 14:35:35,javier_milei,2025-09-09 06:49:10
B-2025-09-02-javier_milei,['javier_milei'],11,2025-09-02 08:45:12,2025-09-06 01:56:00,83f990af-0a57-46fc-9f45-16fec7cc606f,"El juez Alejandro Maraniello, que prohibió difundir los audios de Karina Milei, enfrenta nueve denuncias en su contra: de qué lo acusan","el juez alejandro maraniello, que prohibió difundir los audios de karina milei, enfrenta nueve denuncias en su contra: de qué lo acusan",2025-09-02 13:40:37,javier_milei,2025-09-09 06:49:10
B-2025-09-02-javier_milei,['javier_milei'],11,2025-09-02 08:45:12,2025-09-06 01:56:00,f52f2bef-da1b-4729-99b7-999234b75297,Milei gets judge to ban publication of audio recordings of his sister inside presidential palace,milei gets judge to ban publication of audio recordings of his sister inside presidential palace,2025-09-02 08:45:12,javier_milei,2025-09-09 06:49:10
B-2025-09-02-JP-donald_trump,"['JP', 'donald_trump']",5,2025-09-02 07:45:00,2025-09-05 19:12:38,5f14c64c-b10a-44a4-8e7b-ee193b68b0cf,Trump to direct Japan’s $550bn investment in US after deal with Tokyo,trump to direct japans 550bn investment in us after deal with tokyo,2025-09-05 19:12:38,JP,2025-09-09 06:49:10
B-2025-09-02-JP-donald_trump,"['JP', 'donald_trump']",5,2025-09-02 07:45:00,2025-09-05 19:12:38,6aac1800-f89e-4050-9c8e-b609eb8ad18c,Trump signs order to lower US tariffs on Japan autos to 15%,trump signs order to lower us tariffs on japan autos to 15,2025-09-04 22:39:00,JP,2025-09-09 06:49:10
B-2025-09-02-JP-donald_trump,"['JP', 'donald_trump']",5,2025-09-02 07:45:00,2025-09-05 19:12:38,4969daaf-dc3c-4938-a2ef-75b81ebb6076,"Trump signs executive order implementing trade deal with Japan, White House says","trump signs executive order implementing trade deal with japan, white house says",2025-09-04 20:36:32,JP,2025-09-09 06:49:10
B-2025-09-02-JP-donald_trump,"['JP', 'donald_trump']",5,2025-09-02 07:45:00,2025-09-05 19:12:38,be293283-74d9-4427-872e-5577cac3b008,Trump: US may have to 'unwind' deals with countries if it loses tariff case | NHK WORLD-JAPAN News,trump: us may have to unwind deals with countries if it loses tariff case nhk world-japan news,2025-09-03 16:59:49,JP,2025-09-09 06:49:10
B-2025-09-02-JP-donald_trump,"['JP', 'donald_trump']",5,2025-09-02 07:45:00,2025-09-05 19:12:38,42e00652-07ed-43d8-a98c-678064fd7202,Hope in Tokyo as Trump tariffs declared illegal,hope in tokyo as trump tariffs declared illegal,2025-09-02 07:45:00,JP,2025-09-09 06:49:10
B-2025-09-02-JP-elon_musk,"['JP', 'elon_musk']",1,2025-09-02 03:35:00,2025-09-02 03:35:00,3d7de855-0b55-469f-b07e-868c9dc4f158,Musk voices support for anti-immigration rally in Japan,musk voices support for anti-immigration rally in japan,2025-09-02 03:35:00,JP,2025-09-08 21:22:16
B-2025-09-02-KR-RU,"['RU', 'KR']",1,2025-09-02 07:53:20,2025-09-02 07:53:20,b63d9a5c-e63b-4040-a16e-801173461407,"About 2,000 North Korean Troops Killed in Russia Deployment: Seoul Spy Agency","about 2,000 north korean troops killed in russia deployment: seoul spy agency",2025-09-02 07:53:20,RU,2025-09-08 21:22:16
B-2025-09-02-marine_le_pen,['marine_le_pen'],2,2025-09-02 09:55:16,2025-09-02 10:18:49,3bb372a0-678c-4945-b423-cc3f35729d00,Le Pen urges ‘ultra fast’ dissolution after Bayrou meeting,le pen urges ultra fast dissolution after bayrou meeting,2025-09-02 10:18:49,marine_le_pen,2025-09-08 21:22:16
B-2025-09-02-marine_le_pen,['marine_le_pen'],2,2025-09-02 09:55:16,2025-09-02 10:18:49,f9780057-10e5-47ba-8c91-1fd15bc07027,"Après leur entretien avec Bayrou, Le Pen et Bardella exigent une dissolution ""ultra-rapide""","après leur entretien avec bayrou, le pen et bardella exigent une dissolution ultra-rapide",2025-09-02 09:55:16,marine_le_pen,2025-09-08 21:22:16
B-2025-09-02-mark_carney,['mark_carney'],6,2025-09-02 20:45:09,2025-09-05 22:44:41,100b8ffe-6cdd-41ec-befc-dafffd608a1a,Carney says he won’t judge top aide over ties to Big Tobacco,carney says he wont judge top aide over ties to big tobacco,2025-09-05 22:44:41,mark_carney,2025-09-09 06:49:10
B-2025-09-02-mark_carney,['mark_carney'],6,2025-09-02 20:45:09,2025-09-05 22:44:41,6bd86541-2bc9-48a9-93e7-0342388ead93,Carney will introduce legislation next month to tighten bail system,carney will introduce legislation next month to tighten bail system,2025-09-05 20:57:53,mark_carney,2025-09-09 06:49:10
B-2025-09-02-mark_carney,['mark_carney'],6,2025-09-02 20:45:09,2025-09-05 22:44:41,402abb98-b19c-49fb-b178-cd6058b8d3cb,Carney pushes for 'Buy Canadian' policy and pauses EV targets for 2026,carney pushes for buy canadian policy and pauses ev targets for 2026,2025-09-05 20:27:07,mark_carney,2025-09-09 06:49:10
B-2025-09-02-mark_carney,['mark_carney'],6,2025-09-02 20:45:09,2025-09-05 22:44:41,4c552526-7127-4e17-8e95-d6b836a2de05,Carney pushes for 'Buy Canadian' policy and pauses EV targets for 2026,carney pushes for buy canadian policy and pauses ev targets for 2026,2025-09-05 20:27:07,mark_carney,2025-09-09 06:49:10
B-2025-09-02-mark_carney,['mark_carney'],6,2025-09-02 20:45:09,2025-09-05 22:44:41,12154203-c47a-4f0b-8c24-15147023ee79,"Carney unveils billions in aid to help tariff-hit sectors, delays EV mandate","carney unveils billions in aid to help tariff-hit sectors, delays ev mandate",2025-09-05 14:03:01,mark_carney,2025-09-09 06:49:10
B-2025-09-02-mark_carney,['mark_carney'],6,2025-09-02 20:45:09,2025-09-05 22:44:41,7f16a275-8bff-41c7-83f4-46b27d89e4ef,Carney appoints interim budget watchdog as current officer's term ends,carney appoints interim budget watchdog as current officers term ends,2025-09-02 20:45:09,mark_carney,2025-09-09 06:49:10
B-2025-09-02-robert_fico-vladimir_putin-xi_jinping,"['xi_jinping', 'vladimir_putin', 'robert_fico']",1,2025-09-02 13:21:30,2025-09-02 13:21:30,d9f3f9ec-44c2-4a94-9ea0-29eb1f2f3e42,Slowakei - Fico trifft Putin und Xi - Politik,slowakei - fico trifft putin und xi - politik,2025-09-02 13:21:30,xi_jinping,2025-09-08 21:22:16
B-2025-09-02-RU-UA,"['RU', 'UA']",15,2025-09-02 00:11:35,2025-09-05 05:26:15,0e7cb11f-c3b0-46c0-acd6-fb28ca9dc61e,Russia Rejects Western Security Guarantees for Ukraine After Coalition Pledges Force,russia rejects western security guarantees for ukraine after coalition pledges force,2025-09-05 05:26:15,RU,2025-09-09 06:49:10
