bucket_id,bucket_actors,bucket_size,bucket_start_date,bucket_end_date,title_id,title_display,title_norm,pub_date,gate_actor,bucket_added_at
B-2025-09-01-CN-vladimir_putin-xi_jinping,"['CN', 'xi_jinping', 'vladimir_putin']",12,2025-09-01 08:37:30,2025-09-06 01:51:00,4ac5b846-3c21-4997-a7db-4c3b1f5bce3b,"China's Xi flexes diplomatic clout with Putin, Kim at Beijing parade | Daily Sabah","chinas xi flexes diplomatic clout with putin, kim at beijing parade daily sabah",2025-09-05 10:29:58,CN,2025-09-09 06:49:10
B-2025-09-01-CN-vladimir_putin-xi_jinping,"['CN', 'xi_jinping', 'vladimir_putin']",12,2025-09-01 08:37:30,2025-09-06 01:51:00,75abd059-41a2-4b45-a8d9-40d89316e386,Xi and Putin discuss immortality ahead of Beijing parade,xi and putin discuss immortality ahead of beijing parade,2025-09-04 04:54:00,CN,2025-09-09 06:49:10
B-2025-09-01-CN-vladimir_putin-xi_jinping,"['CN', 'xi_jinping', 'vladimir_putin']",12,2025-09-01 08:37:30,2025-09-06 01:51:00,ceafbf42-120f-4070-b871-3c366a6d1dc0,"China's Xi hosts Putin, Kim at Beijing military parade","chinas xi hosts putin, kim at beijing military parade",2025-09-03 13:07:35,CN,2025-09-09 06:49:10
B-2025-09-01-CN-vladimir_putin-xi_jinping,"['CN', 'xi_jinping', 'vladimir_putin']",12,2025-09-01 08:37:30,2025-09-06 01:51:00,ae7f75fc-a8be-4a4a-8837-99da2bac2afd,"China 'unstoppable', says Xi with Kim, Putin at his side","china unstoppable, says xi with kim, putin at his side",2025-09-03 08:46:49,CN,2025-09-09 06:49:10
B-2025-09-01-CN-vladimir_putin-xi_jinping,"['CN', 'xi_jinping', 'vladimir_putin']",12,2025-09-01 08:37:30,2025-09-06 01:51:00,8fba2c2d-bfdc-41c7-90a5-eb9bc037242d,Kim and Putin join Xi Jinping at massive military parade in Beijing,kim and putin join xi jinping at massive military parade in beijing,2025-09-03 01:51:23,CN,2025-09-09 06:49:10
B-2025-09-01-CN-vladimir_putin-xi_jinping,"['CN', 'xi_jinping', 'vladimir_putin']",12,2025-09-01 08:37:30,2025-09-06 01:51:00,c0e0bad9-231a-4dac-a5a6-b3a175a2ce2b,"Xi, Putin, Kim to share stage in Beijing, not summit table: NIS","xi, putin, kim to share stage in beijing, not summit table: nis",2025-09-02 07:15:09,CN,2025-09-09 06:49:10
B-2025-09-01-CN-vladimir_putin-xi_jinping,"['CN', 'xi_jinping', 'vladimir_putin']",12,2025-09-01 08:37:30,2025-09-06 01:51:00,78ad0fbf-4d6e-41f0-a5eb-2923cbcbb420,North Korea’s Kim arrives in Beijing as Putin and Xi hail ‘old friend’ ties,north koreas kim arrives in beijing as putin and xi hail old friend ties,2025-09-02 04:13:59,CN,2025-09-09 06:49:10
B-2025-09-01-CN-vladimir_putin-xi_jinping,"['CN', 'xi_jinping', 'vladimir_putin']",12,2025-09-01 08:37:30,2025-09-06 01:51:00,f162a350-d7ad-43b0-9d19-d58a41f266db,"(2nd LD) N. Korea's Kim heads for Beijing by train to attend military parade with Putin, Xi","2nd ld n. koreas kim heads for beijing by train to attend military parade with putin, xi",2025-09-01 21:59:40,CN,2025-09-09 06:49:10
B-2025-09-01-CN-vladimir_putin-xi_jinping,"['CN', 'xi_jinping', 'vladimir_putin']",12,2025-09-01 08:37:30,2025-09-06 01:51:00,707c5388-58c7-4b08-8d50-ef312d3ba7df,Xi and Putin round on West at regional summit in China,xi and putin round on west at regional summit in china,2025-09-01 09:52:23,CN,2025-09-09 06:49:10
B-2025-09-01-CN-vladimir_putin-xi_jinping,"['CN', 'xi_jinping', 'vladimir_putin']",12,2025-09-01 08:37:30,2025-09-06 01:51:00,bffbf76c-7d21-4c18-805f-905462a619ef,Xi and Putin take swipe at West during regional summit in China,xi and putin take swipe at west during regional summit in china,2025-09-01 08:37:30,CN,2025-09-09 06:49:10
B-2025-09-01-CO,['CO'],4,2025-09-01 11:08:40,2025-09-05 02:13:00,807f3ca9-bd89-439c-bb8f-52a31bfe74df,"Uruguay, Colombia y Paraguay se clasificaron al Mundial 2026 y dos selecciones buscarán el repechaje","uruguay, colombia y paraguay se clasificaron al mundial 2026 y dos selecciones buscarán el repechaje",2025-09-05 02:13:00,CO,2025-09-09 06:49:10
B-2025-09-01-CO,['CO'],4,2025-09-01 11:08:40,2025-09-05 02:13:00,0d553ad1-b692-4028-93c1-9526f53c985d,Colombia jugará el Mundial después de ocho años tras golear (3-0) a Bolivia,colombia jugará el mundial después de ocho años tras golear 3-0 a bolivia,2025-09-05 01:25:14,CO,2025-09-09 06:49:10
B-2025-09-01-CO,['CO'],4,2025-09-01 11:08:40,2025-09-05 02:13:00,e943811b-c0d4-4b9c-ab10-a609e8cafc9c,Colombia plans to allow commercial hunting of the ‘friendliest animal on the planet’,colombia plans to allow commercial hunting of the friendliest animal on the planet,2025-09-01 14:47:10,CO,2025-09-09 06:49:10
B-2025-09-01-CO,['CO'],4,2025-09-01 11:08:40,2025-09-05 02:13:00,ad08ac7b-c1f4-47e9-b56c-ab191f471102,Colombia on alert as dissident groups ramp up drone attacks,colombia on alert as dissident groups ramp up drone attacks,2025-09-01 11:08:40,CO,2025-09-09 06:49:10
B-2025-09-01-DE,['DE'],22,2025-09-01 10:30:00,2025-09-05 12:58:58,68354a65-c6ee-4989-bd96-f2b054ce0e8f,"Berlin considers purchase of Eurofighters, modernisation of Taurus cruise missile","berlin considers purchase of eurofighters, modernisation of taurus cruise missile",2025-09-05 12:58:58,DE,2025-09-09 06:49:10
B-2025-09-01-DE,['DE'],22,2025-09-01 10:30:00,2025-09-05 12:58:58,91368a4a-cc24-4229-8976-2e0ea975f227,"Berlin considers purchase of Eurofighters, modernisation of Taurus cruise missile","berlin considers purchase of eurofighters, modernisation of taurus cruise missile",2025-09-05 12:58:58,DE,2025-09-09 06:49:10
B-2025-09-01-DE,['DE'],22,2025-09-01 10:30:00,2025-09-05 12:58:58,9854ac1d-c6ff-48b5-85e8-8916259c9e5c,Germany opened its doors to 1 million refugees a decade ago. Here’s how the country has changed since,germany opened its doors to 1 million refugees a decade ago. heres how the country has changed since,2025-09-05 10:28:00,DE,2025-09-09 06:49:10
B-2025-09-01-DE,['DE'],22,2025-09-01 10:30:00,2025-09-05 12:58:58,f8f45c6b-05a4-4973-9ceb-d9f50b0714e3,Far-right Alternative for Germany candidates' deaths spark conspiracies,far-right alternative for germany candidates deaths spark conspiracies,2025-09-05 08:13:25,DE,2025-09-09 06:49:10
B-2025-09-01-DE,['DE'],22,2025-09-01 10:30:00,2025-09-05 12:58:58,3f4dd5c9-e4b5-480a-b40e-f0ca07f1488f,Russian drones over Germany: Why the Bundeswehr cannot intervene,russian drones over germany: why the bundeswehr cannot intervene,2025-09-05 07:39:49,DE,2025-09-09 06:49:10
B-2025-09-01-DE,['DE'],22,2025-09-01 10:30:00,2025-09-05 12:58:58,77e8e208-9f63-4e92-9d58-337373a0d90f,El gran giro de Alemania en inmigración: del “lo lograremos” de Merkel al rechazo frontal de AfD,el gran giro de alemania en inmigración: del lo lograremos de merkel al rechazo frontal de afd,2025-09-05 03:40:00,DE,2025-09-09 06:49:10
B-2025-09-01-DE,['DE'],22,2025-09-01 10:30:00,2025-09-05 12:58:58,8c431fbb-d1f4-4d63-b8c5-a214d377279c,"Germany updates: Coalition backs welfare reform, budget plan","germany updates: coalition backs welfare reform, budget plan",2025-09-04 22:41:15,DE,2025-09-09 06:49:10
B-2025-09-01-DE,['DE'],22,2025-09-01 10:30:00,2025-09-05 12:58:58,1232b79d-b1c1-4c4d-a87f-982ac11d1c52,Germany: Deportations are on the rise,germany: deportations are on the rise,2025-09-04 14:37:30,DE,2025-09-09 06:49:10
B-2025-09-01-DE,['DE'],22,2025-09-01 10:30:00,2025-09-05 12:58:58,17a871aa-21b4-4305-9688-a975f73142be,Sixteen candidates from various parties die ahead of elections in western Germany — media,sixteen candidates from various parties die ahead of elections in western germany media,2025-09-04 13:54:35,DE,2025-09-09 06:49:10
B-2025-09-01-DE,['DE'],22,2025-09-01 10:30:00,2025-09-05 12:58:58,bbadc768-fc47-4df9-af87-458736a63b1d,"Car drives into people in Germany, several injured","car drives into people in germany, several injured",2025-09-04 12:36:28,DE,2025-09-09 06:49:10
B-2025-09-01-DE,['DE'],22,2025-09-01 10:30:00,2025-09-05 12:58:58,00cf6262-b317-498e-b5a9-acc0d0916c13,"Several injured, including children, after car drives into crowd of people in Berlin","several injured, including children, after car drives into crowd of people in berlin",2025-09-04 12:23:56,DE,2025-09-09 06:49:10
B-2025-09-01-DE,['DE'],22,2025-09-01 10:30:00,2025-09-05 12:58:58,c37dfcf2-c805-4753-95cb-821a7d550f35,Germany to Propose Boosting Ukraine’s Air Defenses at Allies’ Meeting,germany to propose boosting ukraines air defenses at allies meeting,2025-09-04 12:00:00,DE,2025-09-09 06:49:10
B-2025-09-01-DE,['DE'],22,2025-09-01 10:30:00,2025-09-05 12:58:58,ffac2bfc-0d85-4e39-8150-5eb93d015fbf,Germany races to find cause of STEC outbreak,germany races to find cause of stec outbreak,2025-09-04 11:26:15,DE,2025-09-09 06:49:10
B-2025-09-01-DE,['DE'],22,2025-09-01 10:30:00,2025-09-05 12:58:58,6dbca5d7-4d36-4453-bed9-780d03ae2647,Germany: Defense commissioner wants mandatory service,germany: defense commissioner wants mandatory service,2025-09-04 04:07:30,DE,2025-09-09 06:49:10
B-2025-09-01-DE,['DE'],22,2025-09-01 10:30:00,2025-09-05 12:58:58,3725b4ec-5540-49b0-b35a-c6f9254a603d,Iraqi migrant suspected of murdering Ukrainian teen in Germany,iraqi migrant suspected of murdering ukrainian teen in germany,2025-09-03 21:07:00,DE,2025-09-09 06:49:10
B-2025-09-01-DE,['DE'],22,2025-09-01 10:30:00,2025-09-05 12:58:58,45b06f9a-d7cf-41f6-aabb-373b4999cd78,Iraqi migrant suspected of murdering Ukrainian teen in Germany,iraqi migrant suspected of murdering ukrainian teen in germany,2025-09-03 21:07:00,DE,2025-09-09 06:49:10
B-2025-09-01-DE,['DE'],22,2025-09-01 10:30:00,2025-09-05 12:58:58,6c3e8e5d-fcf0-4729-b790-334fa2c7852f,«C’est presque impossible statistiquement» : sept candidats nationalistes de l’AfD meurent à quelques jours des élections en Allemagne,cest presque impossible statistiquement : sept candidats nationalistes de lafd meurent à quelques jours des élections en allemagne,2025-09-03 20:49:19,DE,2025-09-09 06:49:10
B-2025-09-01-DE,['DE'],22,2025-09-01 10:30:00,2025-09-05 12:58:58,7fc83978-2874-4f4f-ac3d-4e5db54b5c0c,Germany: AfD politician Krah testifies in Chinese spy case,germany: afd politician krah testifies in chinese spy case,2025-09-03 14:15:00,DE,2025-09-09 06:49:10
B-2025-09-01-DE,['DE'],22,2025-09-01 10:30:00,2025-09-05 12:58:58,48a81af8-f12b-455f-9828-cb88ca343b52,"Streit bei den Füchsen Berlin: Stefan Kretzschmar geht, Bob Hanning bleibt","streit bei den füchsen berlin: stefan kretzschmar geht, bob hanning bleibt",2025-09-03 11:22:20,DE,2025-09-09 06:49:10
B-2025-09-01-DE,['DE'],22,2025-09-01 10:30:00,2025-09-05 12:58:58,9791d704-42d5-4260-8f0e-81ff46cce0e7,Germany resumes resettlement of Afghans over legal pressure,germany resumes resettlement of afghans over legal pressure,2025-09-03 07:00:00,DE,2025-09-09 06:49:10
B-2025-09-01-DE,['DE'],22,2025-09-01 10:30:00,2025-09-05 12:58:58,856f46ee-2c8e-464c-9bca-e5c358411d6b,16-Year-Old Ukrainian Refugee Killed in Germany,16-year-old ukrainian refugee killed in germany,2025-09-01 19:42:24,DE,2025-09-09 06:49:10
B-2025-09-01-DE,['DE'],22,2025-09-01 10:30:00,2025-09-05 12:58:58,fdca574a-e63a-4f45-a69a-ae8c2b3211f8,Polish president seeks reparations from Germany on WWII anniversary,polish president seeks reparations from germany on wwii anniversary,2025-09-01 10:30:00,DE,2025-09-09 06:49:10
B-2025-09-01-DE-EU-UA,"['UA', 'DE', 'EU']",1,2025-09-01 23:37:30,2025-09-01 23:37:30,a2b70ec7-cf44-49d3-93b6-adc760789280,Germany criticizes EU remarks on plans to deploy to Ukraine,germany criticizes eu remarks on plans to deploy to ukraine,2025-09-01 23:37:30,UA,2025-09-08 21:22:16
B-2025-09-01-DE-IN-donald_trump,"['IN', 'DE', 'donald_trump']",1,2025-09-01 14:48:45,2025-09-01 14:48:45,bb32588a-a6ec-46b1-991d-80bab5be75da,Germany aims for closer India trade ties amid Trump tariffs,germany aims for closer india trade ties amid trump tariffs,2025-09-01 14:48:45,IN,2025-09-08 21:22:16
B-2025-09-01-donald_trump-elon_musk,"['donald_trump', 'elon_musk']",7,2025-09-01 05:43:44,2025-09-05 16:09:00,32ec07a3-06af-45dd-adfd-b6610cae532d,Trump extends olive branch to Musk,trump extends olive branch to musk,2025-09-05 16:09:00,donald_trump,2025-09-09 06:49:10
B-2025-09-01-donald_trump-elon_musk,"['donald_trump', 'elon_musk']",7,2025-09-01 05:43:44,2025-09-05 16:09:00,f7184b41-d0cb-4170-bbe2-b1bfa65f9a22,Trump extends olive branch to Musk,trump extends olive branch to musk,2025-09-05 16:09:00,donald_trump,2025-09-09 06:49:10
B-2025-09-01-donald_trump-elon_musk,"['donald_trump', 'elon_musk']",7,2025-09-01 05:43:44,2025-09-05 16:09:00,b55a388a-e7d5-4055-91de-7d2e809ac343,Trump hosts tech titans — but not Musk — at White House,trump hosts tech titans but not musk at white house,2025-09-05 03:57:00,donald_trump,2025-09-09 06:49:10
B-2025-09-01-donald_trump-elon_musk,"['donald_trump', 'elon_musk']",7,2025-09-01 05:43:44,2025-09-05 16:09:00,53ed9c6a-469e-41fa-849f-dcfd17191690,"Trump Hosts Tech CEOs For Dinner At White House, Elon Musk Not Present","trump hosts tech ceos for dinner at white house, elon musk not present",2025-09-05 02:23:00,donald_trump,2025-09-09 06:49:10
B-2025-09-01-donald_trump-elon_musk,"['donald_trump', 'elon_musk']",7,2025-09-01 05:43:44,2025-09-05 16:09:00,5ed721f3-2168-4c7b-ab38-225294f7aaa2,"Trump hosts tech titans, minus estranged top supporter Elon Musk","trump hosts tech titans, minus estranged top supporter elon musk",2025-09-05 02:05:39,donald_trump,2025-09-09 06:49:10
B-2025-09-01-donald_trump-elon_musk,"['donald_trump', 'elon_musk']",7,2025-09-01 05:43:44,2025-09-05 16:09:00,1b7c1323-aab3-4ee2-9afa-03f829ecaffc,Trump hosts US tech leaders at White House dinner – minus Elon Musk,trump hosts us tech leaders at white house dinner minus elon musk,2025-09-04 21:08:00,donald_trump,2025-09-09 06:49:10
B-2025-09-01-donald_trump-elon_musk,"['donald_trump', 'elon_musk']",7,2025-09-01 05:43:44,2025-09-05 16:09:00,fdb68310-7fc5-46b8-88e5-9d1ccd6c3cc2,"Errol Musk, padre de Elon: ""Para mi hijo, estar en el Gobierno de Trump fue como una borrachera""","errol musk, padre de elon: para mi hijo, estar en el gobierno de trump fue como una borrachera",2025-09-01 05:43:44,donald_trump,2025-09-09 06:49:10
B-2025-09-01-EG-GCC-QA,"['QA', 'EG', 'GCC']",1,2025-09-01 08:48:00,2025-09-01 08:48:00,fca96e9f-c79b-450f-972e-abd8667c8ec9,GCC praises Egypt-Qatar mediation efforts to reach ceasefire in Gaza,gcc praises egypt-qatar mediation efforts to reach ceasefire in gaza,2025-09-01 08:48:00,QA,2025-09-08 21:22:16
B-2025-09-01-EU,['EU'],56,2025-09-01 09:30:24,2025-09-06 09:10:00,07acbaae-4bf4-41ef-bfc1-be7aee251989,EU imposes sanctions on Iranian officials over human rights,eu imposes sanctions on iranian officials over human rights,2025-09-06 09:10:00,EU,2025-09-09 06:49:10
B-2025-09-01-EU,['EU'],56,2025-09-01 09:30:24,2025-09-06 09:10:00,511c4124-536a-432f-b61c-ac1699850ef4,Mariani: “Sui missili la Ue entro due anni sarà autosufficiente”,mariani: sui missili la ue entro due anni sarà autosufficiente,2025-09-06 09:09:28,EU,2025-09-09 06:49:10
B-2025-09-01-EU,['EU'],56,2025-09-01 09:30:24,2025-09-06 09:10:00,a5ff3e1f-294d-45bf-bb64-637dbef51f62,EU-Kommission distanziert sich von Genozid-Äußerung,eu-kommission distanziert sich von genozid-äußerung,2025-09-06 09:08:14,EU,2025-09-09 06:49:10
B-2025-09-01-EU,['EU'],56,2025-09-01 09:30:24,2025-09-06 09:10:00,3bd3d302-034f-420c-ba99-de3ec186af64,EU state calls out bloc’s ‘hypocrites’ over Russian oil,eu state calls out blocs hypocrites over russian oil,2025-09-06 08:30:00,EU,2025-09-09 06:49:10
B-2025-09-01-EU,['EU'],56,2025-09-01 09:30:24,2025-09-06 09:10:00,be354bf3-f9ae-490e-8e70-57a0864f3235,EU state calls out bloc’s ‘hypocrites’ over Russian oil,eu state calls out blocs hypocrites over russian oil,2025-09-06 08:30:00,EU,2025-09-09 06:49:10
B-2025-09-01-EU,['EU'],56,2025-09-01 09:30:24,2025-09-06 09:10:00,84507607-95eb-4cef-a531-8195f2faafb9,Google hit with $3.45 billion EU antitrust fine over adtech practices,google hit with 3.45 billion eu antitrust fine over adtech practices,2025-09-05 22:32:28,EU,2025-09-09 06:49:10
B-2025-09-01-EU,['EU'],56,2025-09-01 09:30:24,2025-09-06 09:10:00,a8cfc240-f49c-42be-8389-11049b6fe909,Google hit with $3.45 billion EU antitrust fine over adtech practices,google hit with 3.45 billion eu antitrust fine over adtech practices,2025-09-05 22:32:28,EU,2025-09-09 06:49:10
B-2025-09-01-EU,['EU'],56,2025-09-01 09:30:24,2025-09-06 09:10:00,8d1fc2bf-e08d-4ecb-aa7a-e8ce07599b95,Google Fined $3.5 Billion by EU Over Ad-Tech Business - WSJ,google fined 3.5 billion by eu over ad-tech business - wsj,2025-09-05 21:32:00,EU,2025-09-09 06:49:10
B-2025-09-01-EU,['EU'],56,2025-09-01 09:30:24,2025-09-06 09:10:00,28fea6f4-89aa-49fc-9825-680510267d75,Google fined €2.95bn by EU for abusing advertising dominance,google fined 2.95bn by eu for abusing advertising dominance,2025-09-05 19:42:04,EU,2025-09-09 06:49:10
B-2025-09-01-EU,['EU'],56,2025-09-01 09:30:24,2025-09-06 09:10:00,b72ffb22-c8b5-48d5-899c-920f1d26d704,Google fined €2.95bn by EU for abusing advertising dominance,google fined 2.95bn by eu for abusing advertising dominance,2025-09-05 19:42:04,EU,2025-09-09 06:49:10
B-2025-09-01-EU,['EU'],56,2025-09-01 09:30:24,2025-09-06 09:10:00,5a567684-c351-441a-b0d2-101a4f2e2a5d,Google hit with $3.5 billion fine from European Union in ad-tech antitrust case,google hit with 3.5 billion fine from european union in ad-tech antitrust case,2025-09-05 19:39:00,EU,2025-09-09 06:49:10
B-2025-09-01-EU,['EU'],56,2025-09-01 09:30:24,2025-09-06 09:10:00,ba54d596-4020-4e48-a1b7-db986b378bad,EU-Kommission: Google erhält fast 3 Milliarden Euro Bußgeld wegen Adtech,eu-kommission: google erhält fast 3 milliarden euro bußgeld wegen adtech,2025-09-05 19:27:12,EU,2025-09-09 06:49:10
B-2025-09-01-EU,['EU'],56,2025-09-01 09:30:24,2025-09-06 09:10:00,ad1ca994-6ebc-42a9-a627-ecff78947d27,"Megaoperativo en planta de Hyundai, parte de una investigación criminal; ""no fue operación de inmigración"", dice EU","megaoperativo en planta de hyundai, parte de una investigación criminal; no fue operación de inmigración, dice eu",2025-09-05 19:20:18,EU,2025-09-09 06:49:10
B-2025-09-01-EU,['EU'],56,2025-09-01 09:30:24,2025-09-06 09:10:00,10a4ff8b-2e92-40ef-adc9-ecc6fdc58a71,"Google é multado em quase US$ 3,5 bi pela UE por abuso de poder no setor de publicidade digital","google é multado em quase us 3,5 bi pela ue por abuso de poder no setor de publicidade digital",2025-09-05 18:09:41,EU,2025-09-09 06:49:10
B-2025-09-01-EU,['EU'],56,2025-09-01 09:30:24,2025-09-06 09:10:00,ac2e0113-281d-4e8f-bcfa-d411af965508,EU fines Google nearly €3bn for ‘abusing’ dominant position in ad tech,eu fines google nearly 3bn for abusing dominant position in ad tech,2025-09-05 17:36:00,EU,2025-09-09 06:49:10
B-2025-09-01-EU,['EU'],56,2025-09-01 09:30:24,2025-09-06 09:10:00,490bae99-41b9-474a-b2aa-75bfa074d72b,Despliega EU aviones militares en Puerto Rico por cárteles,despliega eu aviones militares en puerto rico por cárteles,2025-09-05 16:57:00,EU,2025-09-09 06:49:10
B-2025-09-01-EU,['EU'],56,2025-09-01 09:30:24,2025-09-06 09:10:00,84bbc925-515b-410c-a46b-b9669a3b3850,EU distances itself from Ribera's claims of Israeli genocide in Gaza,eu distances itself from riberas claims of israeli genocide in gaza,2025-09-05 16:09:04,EU,2025-09-09 06:49:10
B-2025-09-01-EU,['EU'],56,2025-09-01 09:30:24,2025-09-06 09:10:00,a62414be-22c3-4b4b-93ac-42ad94f313a6,EU Commission hits Google with hefty €2.95 billion fine,eu commission hits google with hefty 2.95 billion fine,2025-09-05 15:55:06,EU,2025-09-09 06:49:10
B-2025-09-01-EU,['EU'],56,2025-09-01 09:30:24,2025-09-06 09:10:00,cf2317d1-b2f4-40ea-a702-58fb2acd5eab,EU countries inch towards Russian oil and gas ban,eu countries inch towards russian oil and gas ban,2025-09-05 12:26:08,EU,2025-09-09 06:49:10
B-2025-09-01-EU,['EU'],56,2025-09-01 09:30:24,2025-09-06 09:10:00,9b51a13e-8a2b-4061-95f8-587736679689,EU enlargement: What do EU citizens think about new countries joining the bloc?,eu enlargement: what do eu citizens think about new countries joining the bloc?,2025-09-05 10:48:28,EU,2025-09-09 06:49:10
B-2025-09-01-EU,['EU'],56,2025-09-01 09:30:24,2025-09-06 09:10:00,73c643e7-6980-447a-b1c3-ca88b846c5ff,Jailing of Euroskeptic Moldovan politician is ‘repression’ – EU lawmaker,jailing of euroskeptic moldovan politician is repression eu lawmaker,2025-09-05 07:38:00,EU,2025-09-09 06:49:10
B-2025-09-01-EU,['EU'],56,2025-09-01 09:30:24,2025-09-06 09:10:00,82f3406f-8b3a-4150-a6a2-162568907d94,Jailing of Euroskeptic Moldovan politician is ‘repression’ – EU lawmaker,jailing of euroskeptic moldovan politician is repression eu lawmaker,2025-09-05 07:38:00,EU,2025-09-09 06:49:10
B-2025-09-01-EU,['EU'],56,2025-09-01 09:30:24,2025-09-06 09:10:00,d24ced18-021a-407b-9c40-8ad915c0b597,VOLTAGE: Is the EU heading empty handed to COP30?,voltage: is the eu heading empty handed to cop30?,2025-09-05 07:23:44,EU,2025-09-09 06:49:10
B-2025-09-01-EU,['EU'],56,2025-09-01 09:30:24,2025-09-06 09:10:00,86985d42-33d5-4002-8b10-b4e62d49ed9b,Time is running out for EU Member States to decide on Chat Control,time is running out for eu member states to decide on chat control,2025-09-05 05:00:09,EU,2025-09-09 06:49:10
B-2025-09-01-EU,['EU'],56,2025-09-01 09:30:24,2025-09-06 09:10:00,b95860b3-45dc-4a1c-855d-b78f0543e84f,Abrirá EU consultas esta semana para renegociación del T-MEC,abrirá eu consultas esta semana para renegociación del t-mec,2025-09-05 03:01:43,EU,2025-09-09 06:49:10
B-2025-09-01-EU,['EU'],56,2025-09-01 09:30:24,2025-09-06 09:10:00,5bfdcc01-d36d-455f-9547-f89bdd9e8d51,EU unveils plans to double financial support for Greenland,eu unveils plans to double financial support for greenland,2025-09-05 02:13:41,EU,2025-09-09 06:49:10
B-2025-09-01-EU,['EU'],56,2025-09-01 09:30:24,2025-09-06 09:10:00,80c46c49-6bff-4093-85e3-845e3b3b9767,European Council chief describes EU expansion as 'important geopolitical investment',european council chief describes eu expansion as important geopolitical investment,2025-09-05 00:53:51,EU,2025-09-09 06:49:10
B-2025-09-01-EU,['EU'],56,2025-09-01 09:30:24,2025-09-06 09:10:00,92af2b1b-872e-40c7-9ce7-b21d6add2f29,Suben acciones de EU y S&P 500 logra nuevo récord,suben acciones de eu y sp 500 logra nuevo récord,2025-09-04 20:57:32,EU,2025-09-09 06:49:10
B-2025-09-01-EU,['EU'],56,2025-09-01 09:30:24,2025-09-06 09:10:00,bcc248cf-0f33-4e74-8f3a-18abdeb593c7,Belgian Foreign Minister: EU credibility on the line over Gaza,belgian foreign minister: eu credibility on the line over gaza,2025-09-04 19:11:38,EU,2025-09-09 06:49:10
B-2025-09-01-EU,['EU'],56,2025-09-01 09:30:24,2025-09-06 09:10:00,5f2563a0-ac25-474c-8d97-57c037d965de,Senior EU official says Israel's war in Gaza is genocide,senior eu official says israels war in gaza is genocide,2025-09-04 17:30:41,EU,2025-09-09 06:49:10
B-2025-09-01-EU,['EU'],56,2025-09-01 09:30:24,2025-09-06 09:10:00,e43a3d9b-f111-4d34-9366-1980e27ba193,EU grants 18.9 million to Moldova to support reform agenda,eu grants 18.9 million to moldova to support reform agenda,2025-09-04 17:25:00,EU,2025-09-09 06:49:10
B-2025-09-01-EU,['EU'],56,2025-09-01 09:30:24,2025-09-06 09:10:00,45a0ef90-500e-487a-8e6f-7e6e6e91ce70,Europe failed to act as Gaza genocide unfolded: Top EU official | Daily Sabah,europe failed to act as gaza genocide unfolded: top eu official daily sabah,2025-09-04 15:21:00,EU,2025-09-09 06:49:10
B-2025-09-01-EU,['EU'],56,2025-09-01 09:30:24,2025-09-06 09:10:00,2239112a-86fd-42df-9461-773c2ae3110a,EU country taps record volume of Russian gas,eu country taps record volume of russian gas,2025-09-04 15:00:00,EU,2025-09-09 06:49:10
B-2025-09-01-EU,['EU'],56,2025-09-01 09:30:24,2025-09-06 09:10:00,7effbb54-98a2-4382-94e6-27779a89c241,EU country taps record volume of Russian gas,eu country taps record volume of russian gas,2025-09-04 15:00:00,EU,2025-09-09 06:49:10
B-2025-09-01-EU,['EU'],56,2025-09-01 09:30:24,2025-09-06 09:10:00,e1763936-5305-4090-b271-4ddefe0c3df1,Defence spending: Which EU countries are on course to hit NATO's 5% of GDP target?,defence spending: which eu countries are on course to hit natos 5 of gdp target?,2025-09-04 13:56:26,EU,2025-09-09 06:49:10
B-2025-09-01-EU,['EU'],56,2025-09-01 09:30:24,2025-09-06 09:10:00,7da1719b-d2c3-45bc-838f-456c15deb9d9,What's behind Putin's remarks on Ukraine's EU membership?,whats behind putins remarks on ukraines eu membership?,2025-09-04 10:36:40,EU,2025-09-09 06:49:10
B-2025-09-01-EU,['EU'],56,2025-09-01 09:30:24,2025-09-06 09:10:00,fe04c0e7-df35-4d66-bfed-33a5d0ef353c,Chinese Mission to EU Marks 80th Anniversary of Victory in War of Resistance and World Anti-Fascist War,chinese mission to eu marks 80th anniversary of victory in war of resistance and world anti-fascist war,2025-09-04 10:02:09,EU,2025-09-09 06:49:10
B-2025-09-01-EU,['EU'],56,2025-09-01 09:30:24,2025-09-06 09:10:00,10364167-1385-498e-9f01-ddd74c907544,EU to US: Ready When You Are,eu to us: ready when you are,2025-09-04 07:08:39,EU,2025-09-09 06:49:10
B-2025-09-01-EU,['EU'],56,2025-09-01 09:30:24,2025-09-06 09:10:00,308da072-5956-404b-8ce2-4650024a9a18,Moldova's Sandu heading down Saakashvili route with misguided EU aspirations — opposition,moldovas sandu heading down saakashvili route with misguided eu aspirations opposition,2025-09-04 07:00:00,EU,2025-09-09 06:49:10
B-2025-09-01-EU,['EU'],56,2025-09-01 09:30:24,2025-09-06 09:10:00,7ab9efa4-ba2a-4d4e-b780-2576973755a1,Pai (e eu) acima de tudo,pai e eu acima de tudo,2025-09-04 02:40:44,EU,2025-09-09 06:49:10
B-2025-09-01-EU,['EU'],56,2025-09-01 09:30:24,2025-09-06 09:10:00,33b8ef16-497e-4a08-a9c2-baf1eb2dc2bd,US and EU sanctions have killed 38 million people since 1970,us and eu sanctions have killed 38 million people since 1970,2025-09-03 17:18:15,EU,2025-09-09 06:49:10
